{
  "schema_version": 1,
  "experiment_id": "exp0304_material_generalization_short",
  "family": "material-generalization",
  "objective": "Run the first short real launch for exp_0304 after the smoke gate passes.",
  "hypothesis": "A controller-managed short run is enough to verify real epoch-mode execution, artifact generation, and monitorability before a full 300-epoch launch.",
  "baseline_refs": [
    "exp0304_material_generalization_smoke",
    "exp0304_material_generalization"
  ],
  "run_root": "controller_runs",
  "autonomy": {
    "mode": "closed_loop",
    "authority_source": "AGENTS.md"
  },
  "default_env": {
    "PYTHONPATH": "."
  },
  "resources": {
    "gpu": "cuda:1",
    "batch_size": 2,
    "num_workers": 0
  },
  "acceptance_criteria": {
    "required_stage_status": {
      "preflight_material_gen": "completed",
      "train_material_gen_short": "completed"
    },
    "required_files": [],
    "result_classification_on_pass": "candidate"
  },
  "failure_policy": {
    "on_stage_failure": "diagnose_and_patch"
  },
  "diagnosis_policy": {
    "mode": "on_failure_or_unmet"
  },
  "patch_policy": {
    "mode": "proposal_only",
    "allowed_paths": [
      "exp_0304/",
      "experiments/manifests/",
      "experiments/adapters/",
      "knowledge/"
    ],
    "auto_apply": true
  },
  "next_step_policy": {
    "on_success": "advance_to_full_run",
    "on_failure": "diagnose_and_patch",
    "on_unmet_criteria": "analyze_and_iterate",
    "auto_generate_manifest": false,
    "auto_queue": false
  },
  "promotion_policy": {
    "mode": "manual_review",
    "auto_promote_on_pass": false
  },
  "supersedes": null,
  "stages": [
    {
      "name": "preflight_material_gen",
      "adapter": "python_script",
      "adapter_id": "exp0304_preflight_material_gen",
      "description": "Verify exp_0304 is ready for the first short real run.",
      "entrypoint": "exp_0304/preflight_material_gen.py",
      "args": [
        "--gpu",
        "cuda:1",
        "--train_cache",
        "/home/sbplab/ruizi/WavTokenize-feature-analysis/data/train_cache_filtered.pt",
        "--val_cache",
        "/home/sbplab/ruizi/WavTokenize-feature-analysis/data/val_cache_filtered.pt",
        "--encoder_ckpt",
        "exp_0227/runs/enc_mrd_fm_epoch_20260227_024953/best_model_val_total.pt",
        "--report_path",
        "{run_dir}/preflight_report.json"
      ],
      "resources": {
        "gpu": "cuda:1"
      }
    },
    {
      "name": "train_material_gen_short",
      "adapter": "python_script",
      "adapter_id": "exp0304_train_material_gen",
      "description": "Run the first short real launch for exp_0304 with controller-owned output paths.",
      "after": [
        "preflight_material_gen"
      ],
      "entrypoint": "exp_0304/train_material_gen.py",
      "args": [
        "--mode",
        "epoch",
        "--epochs",
        "10",
        "--device",
        "cuda:1",
        "--batch_size",
        "2",
        "--grad_accum",
        "1",
        "--num_workers",
        "0",
        "--eval_max_batches",
        "5",
        "--save_checkpoint_every",
        "5",
        "--save_audio_interval",
        "999",
        "--train_cache",
        "/home/sbplab/ruizi/WavTokenize-feature-analysis/data/train_cache_filtered.pt",
        "--val_cache",
        "/home/sbplab/ruizi/WavTokenize-feature-analysis/data/val_cache_filtered.pt",
        "--encoder_ckpt",
        "exp_0227/runs/enc_mrd_fm_epoch_20260227_024953/best_model_val_total.pt",
        "--output_dir",
        "{run_dir}/exp_0304_short"
      ],
      "resources": {
        "gpu": "cuda:1"
      }
    }
  ]
}
